<?xml version="1.0" encoding="UTF-8"?>
<!DOCTYPE resturant SYSTEM "resturant.dtd">
<?xml-stylesheet href="resturantdone.xsl"?>
<resturant xmlns="www.abc.com/resturant" xmlns:xsi="http://www.w3.org/2001/XMLSchema-instance" xsi:schemaLocation="http://www.abc.com/resturant resturant.xsd">
   <placename>
      <place>HSR</place>
      <place>Koramangala</place>
      <place>Madivala</place>
      <place>ChurchStreet</place>
   </placename>
   <cafename>
      <cafe>Rameshwaram</cafe>
      <time>6AM - 11PM</time>
      <cafe>Akkacafe</cafe>
      <time>9AM - 10PM</time>
      <cafe>Truffles</cafe>
      <time>11AM - 12PM</time>
      <cafe>Alchemy</cafe>
      <time>10AM - 11PM</time>
   </cafename>
   <menu>
      <foodtype>Veg</foodtype>
      <foodtype>Non-veg</foodtype>
      <foodtype>Ketodiet</foodtype>
   </menu>
   <food>
      <fooditem type="Italian">
         <name>Pasta</name>
         <cost>350/-</cost>
      </fooditem>
      <fooditem type="Chinese">
         <name>Noodles</name>
         <cost>200/-</cost>
      </fooditem>
      <fooditem type="Italian">
         <name>Pizza</name>
         <cost>300/-</cost>
      </fooditem>
      <fooditem type="American">
         <name>Burger</name>
         <cost>190/-</cost>
      </fooditem>
      <fooditem type="Desserts">
         <name>Tiramisu</name>
         <cost>290/-</cost>
      </fooditem>
      <fooditem type="Beverages">
         <name>Milkshakes</name>
         <cost>190/-</cost>
      </fooditem>
   </food>
   <Ambience>
      <type>Pottery</type>
      <type>Artitery</type>
      <type>Pub</type>
      <type>Club</type>
   </Ambience>
   <travel>
      <traveltype type="bus">
         <name>Koramangala</name>
         <price>20/-</price>
         <name>HSR</name>
         <price>30/-</price>
      </traveltype>
      <traveltype type="car">
         <own>Disel</own>
         <own>Petrol</own>
      </traveltype>
      <traveltype type="vechile">
         <own>Disel</own>
         <own>Petrol</own>
      </traveltype>
      <traveltype type="metro">
         <name>Koramangala</name>
         <price>20/-</price>
         <name>HSR</name>
         <price>30/-</price>
      </traveltype>
   </travel>
   <payment>
      <mode>Gpay</mode>
      <mode>PhonePe</mode>
      <mode>PayTM</mode>
   </payment>
   <discount>
      <voucher>Swiggy</voucher>
      <voucher>Zomato Gold</voucher>
      <voucher>Permium</voucher>
   </discount>
   </resturant>


